{"protocol_version":"atlas-richie.metrics/v2","reporter_id":"reporter-a","startup_epoch":"00000000-0000-4000-8000-000000000001","sequence":9007199254740991,"capture_elapsed_ns":"0","captured_at":"2026-10-11T00:00:00.000000Z","counters":[{"name":"http_requests_completed_total","value":9007199254740991}],"histograms":[],"gauges":[]}
