{"protocol_version":"atlas-richie.metrics/v2","reporter_id":"reporter-empty-histogram","startup_epoch":"00000000-0000-4000-8000-000000000001","sequence":1,"capture_elapsed_ns":"1","captured_at":"2026-10-24T00:00:00.000000Z","counters":[],"histograms":[{"name":"http_request_duration","boundaries_ns":[1000000,5000000,10000000,25000000,50000000,100000000,250000000,500000000,1000000000,2000000000,5000000000,10000000000],"bucket_counts":[0,0,0,0,0,0,0,0,0,0,0,0,0],"sample_count":0,"total_ns":"0","min_ns":null,"max_ns":null}],"gauges":[]}
