{"protocol_version":"atlas-richie.metrics/v2","reporter_id":"reporter-α","startup_epoch":"00000000-0000-4000-8000-000000000001","sequence":2,"capture_elapsed_ns":"2000000000","captured_at":"2026-10-11T00:00:00.123456Z","counters":[{"name":"sentinel_entries_admitted_total","value":42,"resource":"POST /orders"}],"histograms":[{"name":"http_request_duration","boundaries_ns":[1000000,5000000,10000000,25000000,50000000,100000000,250000000,500000000,1000000000,2000000000,5000000000,10000000000],"bucket_counts":[0,1,0,1,1,1,0,0,0,0,0,0,0],"sample_count":4,"total_ns":"180000000","min_ns":5000000,"max_ns":100000000}],"gauges":[{"name":"process_cpu_ratio","value":0.5,"quality":"available"},{"name":"process_memory_ratio","value":null,"quality":"unavailable"}]}
